Job Profile,Count,Black or African American,Asian (United States of America),White (United States of America),Hispanic/Latino (United States of America),Two or More Races (United States of America),Decline to Identify (United States of America),Male,Female
DL1175 Associate Deputy District Attorney,13.0,1.0,0.0,10.0,1.0,0.0,1.0,5.0,8.0
DL1176 Chief Deputy District Attorney,18.0,0.0,0.0,16.0,2.0,0.0,0.0,12.0,6.0
DL1178 Deputy District Attorney,54.0,2.0,2.0,44.0,3.0,3.0,0.0,23.0,31.0
DL1183 Senior Deputy District Attorney,6.0,0.0,0.0,6.0,0.0,0.0,0.0,2.0,4.0
DL1184 Senior Chief Deputy District Attorney,6.0,1.0,0.0,4.0,1.0,0.0,0.0,2.0,4.0
DL1454 Assistant District Attorney,2.0,0.0,0.0,2.0,0.0,0.0,0.0,1.0,1.0
